{
  "name": "model-registry",
  "framework": "pytest",
  "version": "1.0.0",
  "description": "Model Registry Python client and E2E tests using pytest",
  "maintainers": [
    "@model-registry-team"
  ],
  "jenkins": {
    "job_paths": [
      "rhoai/3.4/selfmanaged/cli/aws/rhoai-sanity",
      "rhoai/autotrigger-smoke",
      "odh/selfmanaged/cli/gcp/odh-tier2"
    ],
    "artifact_patterns": [
      "payload_results/ai-hub*.xml",
      "**/model-registry*.xml",
      "shiftleftArtifacts/ai-hub/xunit_report.xml"
    ],
    "test_suite_filter": "Ai Hub",
    "cluster_log_patterns": [
      "shiftleftArtifacts/ai-hub/setup/component-health/pytest-tests.log",
      "shiftleftArtifacts/ai-hub/pytest-tests.log"
    ]
  },
  "test_framework": {
    "type": "pytest",
    "test_directory": "tests/",
    "test_file_pattern": "test_*.py",
    "runner_command": "pytest -v",
    "rerun_command": "pytest -v {spec_path}"
  },
  "cluster": {
    "namespaces": [
      "redhat-ods-applications",
      "model-registry"
    ],
    "resource_types": [
      "pods",
      "deployments",
      "services"
    ]
  },
  "analysis": {
    "parser_module": "parser.py",
    "failure_categories": [
      "timeout",
      "assertion",
      "api_error",
      "database_error",
      "connection_error",
      "unknown"
    ]
  },
  "reporting": {
    "reporter_module": "reporter.py"
  },
  "repository": {
    "url": "https://github.com/opendatahub-io/model-registry",
    "type": "github",
    "default_branch": "main"
  },
  "metadata": {
    "tags": [
      "python",
      "pytest",
      "integration",
      "e2e",
      "ai-hub"
    ],
    "priority": "high"
  }
}
